nlp-news-classification/outputs/runs/berturk_news_classifier_2026-05-08_20-15-53/average_precision_by_class.csv

category,average_precision
spor,0.9943628433640594
gündem,0.9855730604402521
magazin,0.9612772546901714
teknoloji,0.9610260801893319
eğitim,0.9576830811412451
sağlık,0.9570493791437013
siyaset,0.9558959530911925
dünya,0.942167777832315
ekonomi,0.937823065778723
kültürsanat,0.8237751402545849

nlp-news-classification/Readme.md

## 2. Dataset

Category	Average Precision
spor	0.9943
gündem	0.9856
magazin	0.9613
teknoloji	0.9610
eğitim	0.9577
sağlık	0.9570
siyaset	0.9559
dünya	0.9422
ekonomi	0.9378
kültürsanat	0.8238